{
  "$schema": "http://json-schema.org/draft-07/schema#",
  "$id": "memory-index.schema.json",
  "title": "AgentTeams Memory Index (additive lexical retrieval)",
  "description": "Lexical BM25 index emitted by the generator over durable work-summary / CHANGELOG / plan sources. Additive: the original documents are NOT modified and remain the source of truth — the index is a fast-lookup layer the @navigator queries first, then opens the referenced document for detail, then falls back to filesystem search. Generator-owned; excluded from drift by construction (.json; never in output_files_map/template_hashes/file_hashes).",
  "type": "object",
  "additionalProperties": false,
  "required": [
    "artifact_type",
    "memory_index_schema_version",
    "project_name",
    "framework",
    "built_at",
    "source_count",
    "documents",
    "postings",
    "avgdl",
    "N"
  ],
  "properties": {
    "artifact_type": { "const": "memory-index" },
    "memory_index_schema_version": { "type": "string", "minLength": 1 },
    "index_format_version": { "type": "string", "minLength": 1 },
    "index_build_id": {
      "type": "string",
      "pattern": "^[a-f0-9]{64}$"
    },
    "index_write_owner": { "type": "string", "minLength": 1 },
    "vector_runtime_mode": { "type": "string", "minLength": 1 },
    "vector_model_id": { "type": ["string", "null"] },
    "vector_dim": { "type": ["integer", "null"], "minimum": 1 },
    "fallback_policy": { "type": "string", "minLength": 1 },
    "source_fingerprint": {
      "type": "string",
      "pattern": "^[a-f0-9]{64}$"
    },
    "project_name": { "type": "string" },
    "framework": { "type": "string" },
    "built_at": {
      "type": "string",
      "pattern": "^\\d{4}-\\d{2}-\\d{2}T\\d{2}:\\d{2}:\\d{2}(\\.\\d+)?Z$"
    },
    "source_count": { "type": "integer", "minimum": 0 },
    "documents": {
      "type": "array",
      "items": {
        "type": "object",
        "additionalProperties": false,
        "required": ["doc_id", "path", "title", "length", "snippet", "paragraphs", "source_mtime"],
        "properties": {
          "doc_id": { "type": "integer", "minimum": 0 },
          "path": { "type": "string" },
          "title": { "type": "string" },
          "length": { "type": "integer", "minimum": 0 },
          "snippet": { "type": "string" },
          "paragraphs": {
            "type": "array",
            "items": { "type": "string" },
            "description": "Substantive paragraphs extracted at build time for dynamic query-time passage scoring (I2). Up to 20 entries; each truncated at 480 characters."
          },
          "source_hash": {
            "type": "string",
            "pattern": "^[a-f0-9]{64}$"
          },
          "source_mtime": { "type": "number", "minimum": 0 },
          "origin": {
            "enum": ["text", "file"],
            "description": "Where the document came from. \"text\" marks one built from in-memory text (build_memory_index_from_texts), which freshness checks skip; absent or \"file\" means a source file that freshness checks hash. Added in index_format_version json-bm25-postings-v3."
          },
          "vector_norm_sq": {
            "type": "number",
            "minimum": 0,
            "description": "Precomputed full IDF-weighted TF-IDF vector norm-squared for cosine denominator (vector strategy). Added in index_format_version json-bm25-postings-v2; legacy indices without this field fall back to on-the-fly computation."
          }
        }
      }
    },
    "postings": {
      "type": "object",
      "additionalProperties": {
        "type": "array",
        "items": {
          "type": "object",
          "additionalProperties": false,
          "required": ["doc_id", "tf"],
          "properties": {
            "doc_id": { "type": "integer", "minimum": 0 },
            "tf": { "type": "integer", "minimum": 1 }
          }
        }
      }
    },
    "avgdl": { "type": "number", "minimum": 0 },
    "N": { "type": "integer", "minimum": 0 }
  }
}
