{
  "artifact_type": "memory-index",
  "memory_index_schema_version": "1.3",
  "index_format_version": "json-bm25-postings-v2",
  "index_build_id": "f08f9cd3f79827f880a02044e272e77fe5edc98618f137b97bac7d2186c51b69",
  "index_write_owner": "agentteams.build_team",
  "vector_runtime_mode": "sparse-tfidf-cosine",
  "vector_model_id": null,
  "vector_dim": null,
  "fallback_policy": "non-blocking-file-read-then-search",
  "source_fingerprint": "e3b0c44298fc1c149afbf4c8996fb92427ae41e4649b934ca495991b7852b855",
  "project_name": "ResearchPaperProject",
  "framework": "copilot-vscode",
  "built_at": "2026-08-17T12:03:51.322168Z",
  "source_count": 0,
  "documents": [],
  "postings": {},
  "avgdl": 0.0,
  "N": 0
}
